# SPDX-License-Identifier: Apache-2.0
# Hyphae Native G2 bounded SQLLogicTest corpus v1

statement ok
CREATE TABLE accounts (id BIGINT PRIMARY KEY, name TEXT NOT NULL, active BOOLEAN NOT NULL)

statement ok
INSERT INTO accounts (id, name, active) VALUES (1, 'alpha', TRUE)

statement ok
INSERT INTO accounts (id, name, active) VALUES (2, 'beta', FALSE)

query IT rowsort
SELECT id, name FROM accounts ORDER BY id LIMIT 10
----
1 alpha
2 beta

query I
SELECT id FROM accounts WHERE id = 2
----
2

statement ok
UPDATE accounts SET name = 'beta-2' WHERE id = 2

query T
SELECT name FROM accounts WHERE id = 2
----
beta-2

query I
WITH selected AS (SELECT id FROM accounts WHERE active = TRUE LIMIT 10) SELECT id FROM selected LIMIT 10
----
1

query II rowsort
SELECT id, ROW_NUMBER() OVER (ORDER BY id) AS row_number FROM accounts ORDER BY id LIMIT 10
----
1 1
2 2

statement ok
DELETE FROM accounts WHERE id = 1

query I
SELECT id FROM accounts ORDER BY id LIMIT 10
----
2

statement ok
CREATE TABLE metrics (id BIGINT PRIMARY KEY, class TEXT NOT NULL, score BIGINT)

statement ok
INSERT INTO metrics (id, class, score) VALUES (1, 'a', 10), (2, 'a', 20), (3, 'b', NULL), (4, 'b', 40)

query IIIII
SELECT COUNT(*), COUNT(score), SUM(score), MIN(score), MAX(score) FROM metrics WHERE id >= 1 AND id <= 4
----
4 3 70 10 40

query R
SELECT AVG(score) FROM metrics WHERE id >= 1 AND id <= 4
----
23.333

query I
SELECT COUNT(*) FROM metrics
----
4

query III
SELECT COUNT(*), SUM(score), MAX(score) FROM metrics WHERE id >= 100 AND id <= 200
----
0 NULL NULL

statement ok
CREATE TABLE audit (id BIGINT PRIMARY KEY, actor TEXT, note TEXT NOT NULL)

statement ok
INSERT INTO audit (id, actor, note) VALUES (1, 'alice', 'created'), (2, 'albert', 'updated'), (3, NULL, 'archived'), (4, 'bob', 'deleted')

query I
SELECT id FROM audit ORDER BY id DESC LIMIT 2
----
4
3

query I
SELECT id FROM audit WHERE id >= 1 AND id <= 4 AND actor LIKE 'al%' LIMIT 10
----
1
2

query I
SELECT id FROM audit WHERE id >= 1 AND id <= 4 AND actor IN ('bob', 'carol') LIMIT 10
----
4

query I
SELECT id FROM audit WHERE id >= 1 AND id <= 4 AND actor NOT IN ('alice', NULL) LIMIT 10
----

statement ok
CREATE TABLE sales (region TEXT, day BIGINT, total BIGINT, PRIMARY KEY (region, day))

statement ok
INSERT INTO sales (region, day, total) VALUES ('east', 1, 10), ('east', 2, 20), ('west', 1, 5)

query TII
SELECT COUNT(*), SUM(total) FROM sales GROUP BY region LIMIT 10
----
east 2 30
west 1 5
